,mensajes_despedida
0,adios
1,chao
2,hasta
3,gracias
4,bye
5,cerrando
6,fin
7,listo
8,ok
9,adios
10,nos vemos
11,cierro
12,bye bye
13,ciao
14,terminado
15,out
16,later
17,thx
18,bye
19,finalizando
20,goodbye
21,grax
22,hasta luego
23,closer
24,stop
25,done
26,bye ahora
27,cuidate
28,cerrado
29,done
30,bye for now
31,outro
32,bye x
33,hasta pronto
34,fin de convo
35,exit
36,"bye, bot"
37,bye 4 now
38,gracias
39,bye entonces
40,chau
41,bye ya
42,bye 4 u
43,bye-bye
44,bye amigo
45,bye team
46,"bye, gracias"
47,bye todo
48,adios 4ever
49,"bye, nos vemos"
50,gracias por tu ayuda. hasta luego
51,fue un placer hablar contigo. adios
52,"excelente asistencia, nos vemos"
53,me has sido de mucha ayuda. hasta pronto
54,"gracias, eso es todo por ahora. chao"
55,"buen trabajo, bot. nos vemos despues"
56,cierro la conversacion aqui. hasta la proxima
57,has sido muy util. hasta la vista
58,me retiro. hasta luego
59,gracias por la informacion. adios por ahora
60,nos vemos en otra ocasion. chau
61,cerrando la sesion. hasta pronto
62,has cumplido bien tu tarea. adios
63,"buen bot, nos vemos"
64,hasta la proxima vez que necesite ayuda. chao
65,fin de la conversacion. hasta la vista
66,"gracias, bot, nos vemos luego"
67,me despido por ahora. hasta pronto
68,"listo, eso es todo. adios por ahora"
69,terminando la charla. chau
70,cerrando sesion. hasta luego
71,has sido de gran ayuda. adios
72,finalizando la interaccion. hasta la vista
73,"gracias, bot, excelente servicio. nos vemos"
74,es hora de irme. hasta pronto
75,"fin de la conversacion, adios por ahora"
76,gracias por todo. chao
77,terminando aqui. hasta la proxima
78,cerrando esta sesion. hasta luego
79,"ha sido un gusto, bot. adios"
80,nos vemos en otro momento. hasta pronto
81,terminando la comunicacion. chau
82,"gracias, bot, hasta la vista"
83,cierro la conversacion ahora. adios
84,hasta la proxima vez. chao
85,fin de la charla. hasta luego
86,terminando la interaccion. hasta pronto
87,"cerrando sesion, bot. adios por ahora"
88,"gracias, nos vemos. hasta la vista"
89,es hora de despedirse. chau
90,finalizando la conversacion. hasta luego
91,cierro la sesion por ahora. adios
92,hasta la proxima oportunidad. chao
93,termino la interaccion aqui. hasta pronto
94,"gracias por todo, bot. adios por ahora"
95,nos vemos mas adelante. hasta la vista
96,"fin de la charla, chau"
97,cerrando esta conversacion. hasta luego
98,"ha sido un placer, bot. adios"
99,"gracias, nos vemos pronto. hasta la proxima"
100,salir
101,adiosito
102,bye-bye
103,nos vemos luego
104,cerrando ya
105,chau chau
106,hasta pronto
107,hasta la proxima
108,hasta mas tarde
109,bye for now
110,"listo, me voy"
111,"hasta la vista, baby"
112,finalizando ahora
113,gracias y chao
114,terminando aqui
115,"bye, nos leemos"
116,"chau, nos vemos"
117,"bye, hasta manana"
118,adios por ahora
119,hasta el proximo encuentro
120,finiquitando
121,hasta la proxima vez
122,cierre total
123,"bye, cuidate"
124,cierro por hoy
125,hasta la proxima oportunidad
126,"bye, hasta la proxima"
127,gracias y adios
128,chao pescao
129,finiquitado
130,"bye, hasta luego aligator"
131,terminado por ahora
132,"bye, que estes bien"
133,hasta la siguiente charla
134,"chao chao, hasta la proxima"
135,hasta el proximo round
136,hasta la siguiente ocasion
137,"bye, hasta el siguiente round"
138,"chao, hasta otro dia"
139,cerrando el telon
140,finiquitando la tarea
141,"adios, hasta nuevo aviso"
142,"bye, hasta la proxima entrega"
143,hasta la proxima sesion
144,terminando la conversacion
145,"chao, que tengas buen dia"
146,"bye, nos vemos pronto"
147,hasta el proximo capitulo
148,"cerrando sesion, adios"
149,"bye, hasta mas adelante"
150,finiquitamos aqui
151,"chao, cuidate mucho"
152,cerrando la cortina
153,hasta el proximo episodio
154,"bye, que estes genial"
155,"chau, hasta la proxima ocasion"
156,"adios, hasta la proxima vez"
157,"bye, nos vemos en breve"
158,cerrando el libro
159,hasta la proxima entrega
160,"adios, que tengas buen viaje"
161,"bye, hasta la proxima charla"
162,cierro la interaccion
163,"chao, que te vaya bien"
164,hasta la siguiente interaccion
165,"adios, que tengas buen descanso"
166,"bye, hasta la proxima conexion"
167,cerrando el ciclo
168,nos encontramos luego
169,hasta el siguiente encuentro
170,"chao, que tengas lindo dia"
171,"bye, hasta el proximo mensaje"
172,"adios, que tengas bonita tarde"
173,hasta el proximo contacto
174,cerrando el trato
175,"chao, que tengas buenas noches"
176,"bye, hasta la siguiente conversacion"
177,"adios, que tengas dulces suenos"
178,nos vemos en otro momento
179,hasta la proxima fase
180,cerrando la ventana
181,"chao, que tengas excelente dia"
182,"bye, hasta la proxima transmision"
183,"adios, que tengas buena jornada"
184,hasta el siguiente nivel
185,cerrando el archivo
186,nos encontramos en breve
187,"chao, que tengas espectacular noche"
188,"bye, hasta la siguiente etapa"
189,"adios, que tengas grandioso dia"
190,hasta la proxima actualizacion
191,cerrando el programa
192,nos vemos en un rato
193,"chao, que tengas maravillosa tarde"
194,"bye, hasta el proximo acto"
195,"adios, que tengas grandiosa tarde"
196,hasta la proxima intervencion
197,cerrando el servicio
198,nos encontramos despues
199,"chao, que tengas estupendo dia"
200,"bye, hasta el proximo movimiento"
201,"adios, que tengas extraordinario dia"
202,hasta la proxima instancia
203,cerrando la aplicacion
204,nos vemos en un instante
205,"chao, que tengas fabulosa tarde"
206,"bye, hasta la siguiente fase"
207,"adios, que tengas genial dia"
208,hasta la proxima funcion
209,cerrando la puerta
210,nos encontramos mas adelante
211,"chao, que tengas estupendo dia"
212,"bye, hasta la siguiente instancia"
213,"adios, que tengas excelente noche"
214,hasta la proxima mision
215,cerrando el sistema
216,nos encontramos despues
217,"chao, que tengas grandiosa tarde"
218,"bye, hasta la siguiente operacion"
219,"adios, que tengas grandiosa tarde"
220,hasta la proxima fase
221,cerrando la plataforma
222,nos vemos en un rato
223,"chao, que tengas espectacular dia"
224,"bye, hasta la siguiente actualizacion"
225,"adios, que tengas esplendida tarde"
226,hasta la proxima conexion
227,cerrando el portal
228,nos encontramos en breve
229,"chao, que tengas maravillosa noche"
230,"bye, hasta la siguiente etapa"
231,"adios, que tengas increible jornada"
232,hasta la proxima funcion
233,cerrando la puerta
234,nos vemos mas adelante
235,"chao, que tengas fabulosa tarde"
236,"bye, hasta el proximo acto"
237,"adios, que tengas genial dia"
238,hasta la proxima instancia
239,cerrando la ventana
240,nos vemos en un instante
241,"chao, que tengas estupendo dia"
242,"bye, hasta la siguiente fase"
243,"adios, que tengas excelente noche"
244,hasta la proxima mision
245,cerrando el sistema
246,nos encontramos despues
247,"chao, que tengas grandiosa tarde"
248,"bye, hasta la siguiente operacion"
249,"adios, que tengas grandiosa tarde"
250,hasta la proxima fase
251,cerrando la plataforma
252,nos vemos en un rato
253,"chao, que tengas espectacular dia"
254,"bye, hasta la siguiente actualizacion"
255,"adios, que tengas esplendida tarde"
256,hasta la proxima conexion
257,cerrando el portal
258,nos encontramos en breve
259,"chao, que tengas maravillosa noche"
260,"bye, hasta la siguiente etapa"
261,"adios, que tengas increible jornada"
262,hasta la proxima funcion
263,cerrando la puerta
264,nos vemos mas adelante
265,"chao, que tengas fabulosa tarde"
266,"bye, hasta el proximo acto"
267,"adios, que tengas genial dia"
268,hasta la proxima instancia
269,cerrando la ventana
270,nos vemos en un instante
271,"chao, que tengas estupendo dia"
272,"bye, hasta la siguiente fase"
273,"adios, que tengas excelente noche"
274,hasta la proxima mision
275,cerrando el sistema
276,nos encontramos despues
277,"chao, que tengas grandiosa tarde"
278,"bye, hasta la siguiente operacion"
279,"adios, que tengas grandiosa tarde"
280,hasta la proxima fase
281,cerrando la plataforma
282,nos vemos en un rato
283,"chao, que tengas espectacular dia"
284,"bye, hasta la siguiente actualizacion"
285,"adios, que tengas esplendida tarde"
286,hasta la proxima conexion
287,cerrando el portal
288,nos encontramos en breve
289,"chao, que tengas maravillosa noche"
290,"bye, hasta la siguiente etapa"
291,"adios, que tengas increible jornada"
292,hasta la proxima funcion
293,cerrando la puerta
294,nos vemos mas adelante
295,"chao, que tengas fabulosa tarde"
296,"bye, hasta el proximo acto"
297,"adios, que tengas genial dia"
298,hasta la proxima instancia
299,cerrando la ventana
300,nos vemos en un instante
